{
  "compatibility": {
    "chat_template": {
      "notes": "Metadata-only chat template placeholder for registry and dry-run plan tests.",
      "status": "metadata_only",
      "verified": false
    },
    "context_length": 2048,
    "memory": {
      "notes": "Tiny local fixture; no runtime memory probe has been executed.",
      "status": "metadata_only",
      "verified": false
    },
    "quantization": {
      "notes": "4-bit LoRA-compatible path expected; not verified by this metadata scout.",
      "status": "metadata_only",
      "verified": false
    },
    "serving": {
      "notes": "Expected to use an OpenAI-compatible local mock endpoint for future smoke checks.",
      "status": "metadata_only",
      "verified": false
    },
    "structured_outputs": {
      "notes": "Structured-output support is recorded from fixture metadata only.",
      "status": "metadata_only",
      "supported": true,
      "verified": false
    },
    "tokenizer": {
      "notes": "Tokenizer metadata is recorded only; no tokenizer files were downloaded.",
      "status": "metadata_only",
      "verified": false
    },
    "tool_calls": {
      "notes": "Tool-call support is recorded from fixture metadata only.",
      "status": "metadata_only",
      "supported": true,
      "verified": false
    }
  },
  "license": {
    "accepted_terms": true,
    "license_id": "mit",
    "notes": [
      "Synthetic local fixture metadata for model-layer registry coverage.",
      "Do not treat this as a real upstream model license review."
    ],
    "review_status": "approved",
    "reviewed_at": "2026-07-02T00:00:00Z",
    "reviewer": "codex-goal-4-model",
    "source_url": "https://opensource.org/license/mit/",
    "status": "approved",
    "terms_url": "https://opensource.org/license/mit/",
    "training_allowed": true
  },
  "model_id": "local/mock-tiny-chat",
  "notes": [
    "Metadata-only candidate used to verify registry, alias, compatibility, and dry-run plan contracts without weight downloads."
  ],
  "schema_version": "hfr.model_candidate.v1",
  "source": {
    "revision": "metadata-only",
    "type": "local_fixture",
    "url": "file://experiments/registry/model_candidates/local_mock_tiny_chat.json",
    "weight_download_allowed": false
  },
  "candidate_id": "local_mock_tiny_chat"
}
